{
  "schemaVersion": "chatgpt.browser_control.surface_profile.v1",
  "id": "chat-compact-pro-en",
  "observedAt": "2026-08-30",
  "provenance": "Sanitized profile derived from a compact project-conversation composer whose root menu exposes a Power slider and a separate Select model carousel view.",
  "locale": "en-US",
  "region": "not-recorded",
  "accountScope": "not-recorded",
  "planScope": "not-recorded",
  "workspaceScope": "not-recorded",
  "supportState": "current",
  "snapshot": {
    "url": "https://chatgpt.com/g/g-p-sanitized-project/c/sanitized-chat",
    "composerLabels": ["Ask ChatGPT"],
    "mainControls": ["Pro", "Pro feedback", "Send prompt"],
    "mainText": ""
  },
  "panel": {
    "openerLabel": "Pro",
    "axisRows": [],
    "advancedVisible": false
  },
  "menuItems": [
    { "label": "Pro", "normalized": "pro", "role": "menuitem", "ariaLabel": "Select model" },
    { "label": "Power", "normalized": "power", "role": "menuitem", "ariaLabel": "Power" },
    { "label": "GPT-5.6 Sol", "normalized": "gpt-5.6 sol", "role": "menuitemradio", "checked": true },
    { "label": "GPT-5.5", "normalized": "gpt-5.5", "role": "menuitemradio", "checked": false }
  ],
  "expected": {
    "experience": "chat",
    "selectorProfile": "chat_simplified_v1",
    "availableAxes": ["model", "effort"],
    "active": {
      "model": "GPT-5.6 Sol"
    }
  }
}
